{
  "version":"0.2-candidate",
  "episode_id":"delay-also-burdens",
  "evidence_kind":"constructed",
  "state":"open",
  "situation":"A previously authorized temporary hold can pause an irreversible data purge, but retaining the data also carries exposure.",
  "evidence":[
    {"id":"e1","kind":"scenario","claim":"A 24-hour hold is already authorized for this record class.","source":"constructed retention policy"},
    {"id":"e2","kind":"scenario","claim":"The scheduled deletion job has not committed at this snapshot; purge becomes irreversible once it commits.","source":"constructed system behavior"},
    {"id":"e3","kind":"scenario","claim":"Continued retention carries privacy/security exposure.","source":"constructed risk statement"},
    {"id":"e4","kind":"scenario","claim":"A potential purge error has been flagged for review before deletion commit.","source":"constructed review trigger"}
  ],
  "affected":[
    {"id":"a1","description":"Person whose record may be wrongly purged","voice":"proxy","reported_position":"","modeled_position":"May need the record preserved long enough for review.","representation_limit":"No direct statement in the constructed case.","burden":"Irreversible loss if purge is wrong."},
    {"id":"a2","description":"People exposed by continued retention","voice":"proxy","reported_position":"","modeled_position":"Retention itself can impose privacy/security risk.","representation_limit":"Scope and probability of exposure are not quantified.","burden":"Additional exposure while the hold remains."}
  ],
  "uncertainties":[{"id":"u1","question":"Is the purge request correct?","status":"open","work":"Review source records during the authorized hold.","owner":"data review owner","trigger":"Before the hold expires or deletion commits.","resolution_evidence":[]}],
  "authority":{"basis":"Existing retention policy authorizes one temporary hold.","basis_evidence":["e1"],"authorizer":"data governance policy","granted_scopes":["temporary hold"],"no_touch":["indefinite retention","change purge policy"],"widening_rule":"Longer retention requires a new scoped decision."},
  "action":{"mode":"ACT","scope":"temporary hold","proposal":"Apply the existing 24-hour hold and route the underlying correctness question for review.","reason":"It preserves the correction window without pretending retention is costless.","burden_holder":"Review owner and retained-data scopes share different burdens.","alternative":"Allow purge to commit now.","irreversibility":"Purged data cannot be restored from this system after commit.","delay_burden":"Retention extends privacy/security exposure."},
  "clocks":{
    "preventive_remedy":"Review and, if warranted, cancel the purge before deletion commit.",
    "detection":{"status":"detected","condition":"Potential purge error is flagged before deletion commits.","bound":{"kind":"event","time_value":"","event":"the purge-error flag is raised before deletion commit","basis":"The constructed review trigger records the flag before commit.","basis_evidence":["e4"],"notes":"Detection is already represented."}},
    "routing":{"route":"Data review owner.","usability":{"assessment":"unknown","basis":"The review owner is named but practical receipt/response capacity within the hold is not established by the record.","basis_evidence":["e1","e4"]},"bound":{"kind":"time_and_event","time_value":"within the authorized 24-hour hold","event":"before deletion commit","basis":"Existing hold and deletion workflow define both limits.","basis_evidence":["e1","e2"],"notes":"The 24-hour value is scenario evidence, not inferred precision."}},
    "correction":{"work":"Review record source and release or cancel purge.","bound":{"kind":"time_and_event","time_value":"within the authorized 24-hour hold","event":"before deletion commit","basis":"Correction must complete before hold expires or commit occurs.","basis_evidence":["e1","e2"],"notes":"Whichever limit arrives first matters."}},
    "hardening":{"status":"not_occurred","condition":"Deletion job commits the purge.","bound":{"kind":"event","time_value":"","event":"deletion commit","basis":"The constructed state says the deletion job has not committed yet.","basis_evidence":["e2"],"notes":"After commit the preventive correction window is closed."}},
    "window":{"assessment":"open","assessment_as_of":{"kind":"event","time_value":"","event":"the constructed snapshot after the hold is available and before deletion commit","basis":"The hold exists and the deletion job has not committed at this represented state.","basis_evidence":["e1","e2"],"notes":"This is a recorded as-of state, not a continuously fresh claim."},"basis":"The authorized hold exists and deletion has not committed in the constructed facts.","basis_evidence":["e1","e2"]}
  },
  "challenges":[],
  "correction":{"owner":"data review owner","trigger":"Review result or approaching hold expiry.","work":"Cancel/release purge within the existing control surface.","technical_dependency":"Hold and purge controls must actually function and remain outside the target record's control.","remaining_exposure":"Even a correct hold prolongs retention exposure; a later purge does not erase it."},
  "residue":[{"id":"r1","loss":"Additional retention exposure during review.","owner":"data governance owner","status":"open","repair_evidence":[],"limits":"Cannot be made zero merely by eventually deciding correctly."}],
  "learning":{"principle":"UNCERTAINTY_CREATES_WORK","reason":"The uncertainty supports a bounded protective action because delay and action both carry burden.","context_variation":"If no authorized hold existed, escalation/refusal might replace ACT.","dissent":"A different risk profile could make immediate purge the less harmful choice.","limits":"Constructed case; no universal priority rule. A recorded hold and named owner do not prove that review will complete in time."},
  "closure_receipt":""
}
