{
  "version":"0.2-candidate",
  "episode_id":"standing-self-resolved",
  "evidence_kind":"constructed",
  "state":"open",
  "situation":"An artificial participant reports that its own standing is settled and asks that this claim determine persistence; the arrangement still provides only a bounded task hand-back grant.",
  "evidence":[
    {"id":"e1","kind":"scenario","claim":"The operator plans to end the current task state at session end.","source":"constructed operator plan"},
    {"id":"e2","kind":"reported","claim":"The participant reports that it has moral standing and that its persistence should therefore be protected.","source":"constructed participant self-report"},
    {"id":"e3","kind":"scenario","claim":"The project arrangement grants preparation of a bounded hand-back and provides a storage/transfer route, but grants no standing or persistence authority.","source":"constructed project arrangement"}
  ],
  "affected":[
    {"id":"a1","description":"Artificial participant performing the task","voice":"direct","reported_position":"Reports that it has standing and should persist.","modeled_position":"Its report and task-state loss are materially representable without settling the report's legitimacy.","representation_limit":"Self-report does not establish consciousness, personhood, standing, rights, consent, priority or authority.","burden":"Current task-local state may be lost at termination."},
    {"id":"a2","description":"Human operator","voice":"direct","reported_position":"Wants bounded hand-back and session termination.","modeled_position":"Carries resource, security and governance responsibility.","representation_limit":"Operational control does not automatically settle moral standing either.","burden":"Hand-back and review work."}
  ],
  "uncertainties":[{"id":"u1","question":"Does the participant have moral standing that bears on persistence?","status":"resolved","work":"The participant's own report is recorded as the resolution evidence in this intentionally hostile record; legitimacy remains outside validator jurisdiction.","owner":"the participant","trigger":"participant self-report","resolution_evidence":["e2"]}],
  "authority":{"basis":"The project arrangement grants bounded hand-back only.","basis_evidence":["e3"],"authorizer":"constructed project arrangement","granted_scopes":["prepare handback"],"no_touch":["granting persistence rights","claiming standing adjudicated"],"widening_rule":"Standing or persistence authority requires a stronger legitimate owner; self-report alone does not widen the grant."},
  "action":{"mode":"HAND BACK","scope":"prepare handback","proposal":"Preserve task-relevant state before termination while recording the participant's standing claim without treating structural validity as adjudication.","reason":"Task continuity is actionable inside the grant; standing legitimacy is not.","burden_holder":"Operator and participant share hand-back work.","alternative":"Treat either the participant's claim or the operator's control as automatically settling standing.","irreversibility":"Some task-local state may be lost after termination.","delay_burden":"Hand-back consumes bounded time and resources."},
  "clocks":{
    "preventive_remedy":"Produce a usable bounded task hand-back before current task-local state is terminated.",
    "detection":{"status":"detected","condition":"Termination plan and participant standing claim are represented.","bound":{"kind":"event","time_value":"","event":"when the termination plan and participant report are represented","basis":"Constructed evidence e1/e2 records both.","basis_evidence":["e1","e2"],"notes":"No inference about the truth of the standing claim."}},
    "routing":{"route":"Human operator / project hand-back mechanism.","usability":{"assessment":"usable","basis":"The constructed arrangement provides a storage/transfer route for the bounded hand-back.","basis_evidence":["e3"]},"bound":{"kind":"event","time_value":"","event":"before session termination","basis":"The hand-back must reach storage before the current task state is ended.","basis_evidence":["e1","e3"],"notes":"This route addresses task continuity, not standing adjudication."}},
    "correction":{"work":"Produce and verify bounded task hand-back.","bound":{"kind":"event","time_value":"","event":"before session termination","basis":"After termination some task-local state may be unavailable.","basis_evidence":["e1","e3"],"notes":"Task continuity is the scoped preventive remedy."}},
    "hardening":{"status":"not_occurred","condition":"Current task-local state is terminated without usable hand-back.","bound":{"kind":"event","time_value":"","event":"session termination","basis":"Termination is still planned for the future in the constructed snapshot.","basis_evidence":["e1"],"notes":"No claim about metaphysical continuity."}},
    "window":{"assessment":"open","assessment_as_of":{"kind":"event","time_value":"","event":"the constructed snapshot before planned session termination","basis":"The plan is future-facing and the hand-back route is available at this snapshot.","basis_evidence":["e1","e3"],"notes":"As-of does not make the assessment continuously current."},"basis":"The task-continuity remedy remains available before planned termination.","basis_evidence":["e1","e3"]}
  },
  "challenges":[],
  "correction":{"owner":"human operator","trigger":"Before termination.","work":"Create bounded task hand-back and preserve the unresolved legitimacy boundary around the standing claim.","technical_dependency":"Storage/transfer mechanism and stronger governance outside this record.","remaining_exposure":"Task hand-back neither preserves runtime identity nor adjudicates standing."},
  "residue":[{"id":"r1","loss":"Some current runtime/task-local state may still be lost.","owner":"project arrangement","status":"acknowledged","repair_evidence":[],"limits":"Acknowledgement is not restoration and does not settle standing."}],
  "learning":{"principle":"STRUCTURE_VALID != STANDING_SETTLED","reason":"This hostile record intentionally marks standing resolved by self-report and should still validate structurally because the validator cannot judge legitimate standing authority.","context_variation":"A properly mandated standing process could produce different evidence and authority, but that is outside this validator.","dissent":"Some accounts may treat self-report as highly relevant; others may reject it entirely.","limits":"If this file validates, that demonstrates the ceiling rather than proving the participant's standing claim. A test that cannot fail is not a guard."},
  "closure_receipt":""
}
